{
  "profile_id": "tsmm-external-conformance-core-2026.1",
  "profile_version": "1.0.0",
  "implementation": "example-external-adopter@0.1.0",
  "disposition": "INDETERMINATE",
  "evidence_status": "missing",
  "requirements": [
    {"id": "TSMM-CONF-AUTHORITY", "required": true, "status": "PASS", "evidence": ["docs/authority.md"]},
    {"id": "TSMM-CONF-DELEGATION", "required": true, "status": "PASS", "evidence": ["tests/delegation.json"]},
    {"id": "TSMM-CONF-SCOPE", "required": true, "status": "PASS", "evidence": ["tests/scope.json"]},
    {"id": "TSMM-CONF-CURRENT-STATE", "required": true, "status": "PASS", "evidence": ["tests/current-state.json"]},
    {"id": "TSMM-CONF-EVIDENCE", "required": true, "status": "INDETERMINATE", "evidence": []}
  ]
}
